<!ELEMENT dataset (
        Lang*,
        Room*,
        Tag*,
        Users*)>

        <!ELEMENT Lang EMPTY>
        <!ATTLIST Lang
                ID CDATA #REQUIRED
                NAME CDATA #REQUIRED
                >

        <!ELEMENT Room EMPTY>
        <!ATTLIST Room
                ID CDATA #REQUIRED
                NAME CDATA #REQUIRED
                ACTIVE CDATA #REQUIRED
                CREATION_DATE CDATA #REQUIRED
                >

        <!ELEMENT Tag EMPTY>
        <!ATTLIST Tag
                TAG CDATA #REQUIRED
                TEXT CDATA #REQUIRED
                LANG_ID CDATA #REQUIRED
                >

        <!ELEMENT Users EMPTY>
        <!ATTLIST Users
                ID CDATA #REQUIRED
                NAME CDATA #REQUIRED
                ACTIVE CDATA #REQUIRED
                LANG_ID CDATA #REQUIRED
                CREATION_DATE CDATA #REQUIRED
                >